{"accepted_input_schemas":["dsp-graph-v0","instrument-v0"],"artifact_declarations":[{"artifact_kind":"arm-object","media_type":"application/x-elf-object","producer_stage":"target-compile-link"},{"artifact_kind":"generated-cpp","media_type":"text/x-c++src","producer_stage":"artifact-generation"},{"artifact_kind":"link-map","media_type":"text/plain","producer_stage":"target-compile-link"},{"artifact_kind":"resolution-plan","media_type":"application/vnd.schuss.resolution-plan+json","producer_stage":"implementation-resolution"},{"artifact_kind":"source-map","media_type":"application/vnd.schuss.source-map+json","producer_stage":"artifact-generation"},{"artifact_kind":"target-executable","media_type":"application/x-elf","producer_stage":"target-compile-link"}],"backend_id":"schuss-backend-000002","bridge_boundary":{"execution_status":"not-run","kind":"direct-runtime-abi","legacy_boundary_artifact":"generated-cpp","location":"packages/schuss_core"},"canonical_profile":"schuss-canonical-json-v1","capability_vocabulary_reference":{"capability_vocabulary_id":"schuss-capability-vocabulary-000001","content_hash":"sha256:37770109d3aff88a67ab031a6ee21c49eb4d301e2933c4659efd38c4496cca92","revision":1},"content_hash":"sha256:da0b542d3797e95df7bc529875c02a00d891d9195565ab6be73cb561d2cabe05","determinism_contract":{"identical_closure_requires_identical_bytes":true,"stable_ordering":true,"timestamps_in_canonical_identity":false},"diagnostic_contract":{"host_paths_in_identity":false,"source_map_required_after_generation":true,"structured_codes":true,"unordered_logs_as_identity":false},"display_name":"Partial direct Ksoloti effects semantic backend","firmware_runtime_reference":{"build_environment_id":"schuss-build-environment-000002","content_hash":"sha256:a656a898798cad529dfec7b02f0a881b61b93e150dd0788b7028ec8e5e4ce2df","revision":2},"lowering_identity":{"backend_kind":"direct-ksoloti-runtime","contract_version":"direct-effects-task025-partial-v1"},"permitted_stopping_stages":["artifact-generation","backend-lowering","implementation-resolution","schema-identity-validation","target-backend-validation","target-compile-link","target-independent-graph-validation"],"required_target_capabilities":[{"capability_key":"audio-stream-fixed-q27","comparison_rule":"exact","value":true},{"capability_key":"control-stream-fixed-q27","comparison_rule":"exact","value":true}],"revision":3,"schema_version":"backend-v0","stage_contract":[{"ordinal":1,"permitted_statuses":["failed","success"],"stage":"schema-identity-validation","stage_kind":"validation"},{"ordinal":2,"permitted_statuses":["failed","not-run","success","unresolved"],"stage":"target-independent-graph-validation","stage_kind":"validation"},{"ordinal":3,"permitted_statuses":["failed","not-run","success","unresolved","unsupported"],"stage":"target-backend-validation","stage_kind":"validation"},{"ordinal":4,"permitted_statuses":["failed","not-run","success","unresolved","unsupported"],"stage":"implementation-resolution","stage_kind":"resolution"},{"ordinal":5,"permitted_statuses":["failed","not-run","success","unresolved","unsupported"],"stage":"compound-elaboration","stage_kind":"planning"},{"ordinal":6,"permitted_statuses":["failed","not-run","success","unresolved","unsupported"],"stage":"dependency-resource-planning","stage_kind":"planning"},{"ordinal":7,"permitted_statuses":["failed","not-run","success","unresolved","unsupported"],"stage":"backend-lowering","stage_kind":"lowering"},{"ordinal":8,"permitted_statuses":["failed","not-run","success","unresolved","unsupported"],"stage":"artifact-generation","stage_kind":"generation"},{"ordinal":9,"permitted_statuses":["failed","not-run","success","unresolved","unsupported"],"stage":"target-compile-link","stage_kind":"tool-execution"},{"ordinal":10,"permitted_statuses":["failed","not-run","success","unresolved","unsupported"],"stage":"packaging-evidence-recording","stage_kind":"recording"}],"supported_realization_forms":["native-cpp","transparent-compound"],"target_pairings":[{"contract_state":"declared","rationale":"Task 025 promotes five exact native operation semantics while the selected reverb remains explicitly unsupported; no full-graph handler exists.","target_reference":{"compute_target_id":"schuss-compute-target-000001","content_hash":"sha256:d8a9652bd079d0f2a8806cc4922f2a380c8092549f267047d5a4a0360b4a6753","revision":2}}],"toolchain_reference":{"build_environment_id":"schuss-build-environment-000001","content_hash":"sha256:d460d5414ec534c242f9b3146b1123cb04b35fcf9af9a02452c11ada84b97bff","revision":2}}
