{"accepted_input_schemas":["dsp-graph-v0","instrument-v0"],"artifact_declarations":[{"artifact_kind":"build-package","media_type":"application/vnd.schuss.host-runtime-package+json","producer_stage":"artifact-generation"},{"artifact_kind":"resolution-plan","media_type":"application/vnd.schuss.resolution-plan+json","producer_stage":"implementation-resolution"},{"artifact_kind":"source-map","media_type":"application/vnd.schuss.source-map+json","producer_stage":"artifact-generation"}],"backend_id":"schuss-backend-000003","bridge_boundary":{"execution_status":"not-run","kind":"portable-host-runtime","legacy_boundary_artifact":"build-package","location":"packages/schuss_rt"},"canonical_profile":"schuss-canonical-json-v1","capability_vocabulary_reference":{"capability_vocabulary_id":"schuss-capability-vocabulary-000001","content_hash":"sha256:37770109d3aff88a67ab031a6ee21c49eb4d301e2933c4659efd38c4496cca92","revision":1},"content_hash":"sha256:c188a702201625cbf32d49976ce54a06194dea89d3815e972e319f4b6199a116","determinism_contract":{"identical_closure_requires_identical_bytes":true,"stable_ordering":true,"timestamps_in_canonical_identity":false},"diagnostic_contract":{"host_paths_in_identity":false,"source_map_required_after_generation":true,"structured_codes":true,"unordered_logs_as_identity":false},"display_name":"Portable desktop host runtime backend","firmware_runtime_reference":{"build_environment_id":"schuss-build-environment-000004","content_hash":"sha256:8c313c8978792f09db0cec65bbddb5ffb4cab64d77bce38181727088f07516c8","revision":1},"lowering_identity":{"backend_kind":"desktop-host-runtime","contract_version":"task031-host-q27-v0"},"permitted_stopping_stages":["artifact-generation","backend-lowering","implementation-resolution","schema-identity-validation","target-backend-validation","target-compile-link","target-independent-graph-validation"],"required_target_capabilities":[{"capability_key":"audio-stream-fixed-q27","comparison_rule":"exact","value":true},{"capability_key":"control-stream-fixed-q27","comparison_rule":"exact","value":true}],"revision":1,"schema_version":"backend-v0","stage_contract":[{"ordinal":1,"permitted_statuses":["failed","success"],"stage":"schema-identity-validation","stage_kind":"validation"},{"ordinal":2,"permitted_statuses":["failed","not-run","success","unresolved"],"stage":"target-independent-graph-validation","stage_kind":"validation"},{"ordinal":3,"permitted_statuses":["failed","not-run","success","unresolved","unsupported"],"stage":"target-backend-validation","stage_kind":"validation"},{"ordinal":4,"permitted_statuses":["failed","not-run","success","unresolved","unsupported"],"stage":"implementation-resolution","stage_kind":"resolution"},{"ordinal":5,"permitted_statuses":["failed","not-run","success","unresolved","unsupported"],"stage":"compound-elaboration","stage_kind":"planning"},{"ordinal":6,"permitted_statuses":["failed","not-run","success","unresolved","unsupported"],"stage":"dependency-resource-planning","stage_kind":"planning"},{"ordinal":7,"permitted_statuses":["failed","not-run","success","unresolved","unsupported"],"stage":"backend-lowering","stage_kind":"lowering"},{"ordinal":8,"permitted_statuses":["failed","not-run","success","unresolved","unsupported"],"stage":"artifact-generation","stage_kind":"generation"},{"ordinal":9,"permitted_statuses":["failed","not-run","success","unresolved","unsupported"],"stage":"target-compile-link","stage_kind":"tool-execution"},{"ordinal":10,"permitted_statuses":["failed","not-run","success","unresolved","unsupported"],"stage":"packaging-evidence-recording","stage_kind":"recording"}],"supported_realization_forms":["native-cpp"],"target_pairings":[{"contract_state":"declared","rationale":"The Task 031 host backend consumes only the exact seven-node profile and fails closed for every other node.","target_reference":{"compute_target_id":"schuss-compute-target-000002","content_hash":"sha256:8e66c6e40db0215c69c44852f6838a289342f372379262b87acc4a2bb49bd290","revision":1}}],"toolchain_reference":{"build_environment_id":"schuss-build-environment-000003","content_hash":"sha256:d59193a7a84a1633627c9eef292f33f854728358ef1d524a542ead67c7c5546a","revision":1}}
